{
  "$schema": "http://json-schema.org/draft-07/schema#",
  "type": "object",
  "required": ["name", "description", "details", "color", "duration", "impact"],
  "properties": {
    "name": { "type": "string" },
    "description": { "type": "string" },
    "details": { "type": "string" },
    "color": {
      "type": "string",
      "pattern": "^#[0-9a-fA-F]{6}$"
    },
    "duration": {
      "type": "string",
      "pattern": "^[0-9]+$"
    },
    "impact": {
      "type": "object",
      "required": ["Action", "Etf", "Crypto", "MatierePremieres", "Obligations"],
      "properties": {
        "Action": { "type": "number" },
        "Etf": { "type": "number" },
        "Crypto": { "type": "number" },
        "MatierePremieres": { "type": "number" },
        "Obligations": { "type": "number" }
      }
    }
  },
  "additionalProperties": false
}
