{
    "name": "Manipulation Massives d’Indices",
    "description": "Scandale sur les cours des indices boursiers mondiaux",
    "details": "Une enquête révèle que plusieurs grands indices boursiers ont été manipulés pendant des années, sapant la confiance des investisseurs.",
    "color": "#b91c1c",
    "duration": "20",
    "impact": {
      "Action": -50,
      "Etf": -45,
      "Crypto": -10,
      "MatierePremieres": 5,
      "Obligations": 25
    }
  }
  