{
    "name": "Stagflation Mondiale 2025",
    "description": "Croissance en berne et inflation persistante",
    "details": "Les économies développées subissent une croissance molle accompagnée d’une inflation élevée. Les banques centrales hésitent entre relancer ou contrôler les prix.",
    "color": "#f59e0b",
    "duration": "18",
    "impact": {
      "Action": -25,
      "Etf": -20,
      "Crypto": -10,
      "MatierePremieres": 15,
      "Obligations": -10
    }
  }
  